Reference,SpeechId,Direction,SttLatency,length,beginOfSpeech,endOfSpeech,SttResult,TranslationLatency,length,TranslatedResult,useless,translation comment
1713539013761
,1713539012447,1,709ms,5,1713539012453,1713539014443,Hello,375ms,4,Hola
,1713539021365,1,439ms,42,1713539021367,1713539025202,My name is Partha I'm calling from India.,120ms,48,mi nombre es partha estoy llamando de la india.
,1713539023724,0,435ms,4,1713539023726,1713539025855,Hola,151ms,5,Hello
,1713539031444,0,476ms,27,1713539031446,1713539034361,Hola aparta. ¿Cómo estás? ,59ms,26,Hello apart. How are you?
,1713539038441,1,464ms,59,1713539038442,1713539044683,I'm doing good. How about you? May I know your name please?,1713539045147ms,82,Lo estoy haciendo bien. ¿Qué onda contigo? ¿puedo saber cómo te llamas por favor?
,1713539050445,0,423ms,24,1713539050447,1713539053503,Sí mi nombre es Carla. ,74ms,22,Yes my name is Carla.
,1713539058563,1,424ms,22,1713539058565,1713539061161,And where do you live?,65ms,15,¿Y dónde vives?
,1713539065726,0,460ms,26,1713539065727,1713539068722,Vivo en Chicago illenoi. ,70ms,28,I live in Chicago Illinois.
,1713539074802,1,471ms,38,1713539074803,1713539077963,I've heard it's a very beautiful city.,85ms,37,He oído que es una ciudad muy bonita.
,1713539084121,0,490ms,68,1713539084123,1713539091961,Chicago es una ciudad bastante metropolitana y esa bastante grande. ,103ms,59,Chicago is a fairly metropolitan city and that's quite big.
,1713539093045,0,400ms,23,1713539093046,1713539096172,Con diferentes climas. ,51ms,24,With different climates.
,1713539100201,1,426ms,23,1713539100203,1713539102721,How is the weather now?,58ms,24,Cómo está el clima ahora
,1713539107650,0,666ms,125,1713539107652,1713539122845,Poco fresco estamos en primavera. Está ubicada cerca del las orillas del lago entonces de repente se pone bastante fresco. ,214ms,102,Uncool it's spring. It's located near the shores of the lake so all of a sudden it gets pretty cool.
,1713539136362,1,442ms,29,1713539136363,1713539139483,Is it near the Lake Michigan?,72ms,30,¿Está cerca del lago Michigan?
,1713539144880,0,668ms,111,1713539144882,1713539157801,Si me queda más o menos como a 40 minutos de donde estoy viviendo en este momento por vía eh quinta estatal. ,203ms,96,If I'm more or less more than 40 minutes away from where I'm living right now huh fifth state.
,1713539166720,1,313ms,4,1713539166722,1713539168763,Okay,37ms,9,Está bien
,1713539172283,1,554ms,82,1713539172284,1713539180002,I've heard that Chicago is home to 24 beaches along the Lake Michigan is it true?,158ms,86,He oído que Chicago es el hogar de 24 playas a lo largo del lago Michigan ¿es cierto?
,1713539189847,0,470ms,41,1713539189848,1713539195334,Sí tenemos bastantes playas cercas del. ,110ms,42,Yes we have quite a few beaches near the.
,1713539195846,0,738ms,183,1713539195847,1713539218847,De toda el área porque abarca 5 diferentes lagos entonces ya tenemos bastantes playas y eso incluye. Creo que son de 3 a 4 diferentes estados va incluyendo eh indiana y a wiscan. ,290ms,193,Of the whole area because it covers 5 different lakes then we already have enough beaches and that includes. I think it's three to four different states going including eh Indiana and swan.
,1713539236047,1,522ms,68,1713539236050,1713539241920,How far will be the Ohio street beach from the place where you stay?,164ms,78,¿A qué distancia estará la playa de la calle Ohio del lugar donde te hospedas?
,1713539251122,0,965ms,220,1713539251123,1713539271803,Prácticamente lo que dije son como 40 minutos a cualquier lado donde lo mires dependiendo el interés estatal que escojas pero la playa Ohio está prácticamente cerca del centro de la ciudad. Entonces no está muy lejos. ,459ms,182,Practically what I said is like 40 minutes anywhere you look at it depending on the state interest you choose but Ohio Beach is pretty much close to downtown. So it's not far away.
,1713539290486,1,374ms,4,1713539290490,1713539292402,Okay,16ms,9,Está bien
,1713539293763,1,587ms,39,1713539293764,1713539298369,Is Chicago affordable for the tourists?,152ms,40,¿Es Chicago asequible para los turistas?
,1713539304206,0,3143ms,1109,1713539304208,1713539413683,O definitivamente Chicago es una de las ciudades más grandes y vibrantes de Estados Unidos está ubicada en el Oeste del estado de Illinois y a orillas del es conocida por es como decir la ciudad de los vientos y es alumna de la segunda ciudad. El Chicago es muy importante es un centro cultural económico y turístico con una. Rica historia. Y una impresionante arquitectura Chicago es famosa por su arquitectura distinta que incluye rascacielos iconos como la Torre Willis que ahora es conocida como la torre sears el edificio John Hancock eh el Iron sunner y muchos otros la ciudad también ha es conocida por su arquitectura modernista y sus diseños. Innovadores. Y en Chicago tenemos ofrecemos 1:00 amplia gama de actividades culturales que incluyen museos de renombre mundial como el instituto de arte el museo de ciencia el filo musi el museo de ciencia es museo de ciencia e industria. La ciudad también es conocida por una escena teatral. Con producciones de broadway música en vivo festivales de cine eventos culturales durante todo el año. También tenemos una muy buena gastronomía eh?,2551ms,1035,Or Chicago is definitely one of the largest and most vibrant cities in the United States it's located in the west of the state of Illinois and on the banks of the is known as the city of winds and is a student of the second city. Chicago is very important it's a cultural economic and tourist center with one. Rich history. And stunning Chicago architecture is famous for its distinct architecture which includes iconic skyscrapers like the Willis Tower which is now known as the sears tower the John Hancock building eh the Iron sunner and many others the city has also been known for its modernist architecture and designs. Innovative. And in Chicago we have 1:00 wide range of cultural activities that include world-renowned museums like the art institute the science museum the philo musi the science museum is a science and industry museum. The city is also known for a theatrical scene. With Broadway productions live music film festivals cultural events throughout the year. We also have a very good cuisine huh?
,1713539414239,0,824ms,121,1713539414240,1713539428096,La gastronomía prácticamente es una gastronomía mundial especialmente por su estilo Chicago dipt los perros calientes. ,325ms,91,Gastronomy is practically a world cuisine especially for its Chicago dipt style hot dogs.
,1713539428444,0,592ms,41,1713539428460,1713539433292,Los platos de carne Ahumada en Barbecue. ,176ms,35,The meat dishes Smoked in Barbecue.
,1713539435405,0,1693ms,416,1713539435406,1713539476565,Música es muy conocida por los blues y el hogar del jazz también la hay plus legendarios de música Blue Brothers house of blues ya shaw case la ciudad también es muy importante centro de entretenimiento con conciertos festivales y eventos deportivos durante todo el año así que ahí también tenemos. Espacios verdes bulliciosos Chicago cuenta con una gran cantidad de espacios verdes millennium Park Grant Park.,1171ms,366,Music is well known for the blues and the home of jazz there is also the legendary plus music Blue Brothers house of blues and shaw case the city is also very important entertainment center with concerts festivals and sporting events throughout the year so there we also have. Green bustling spaces Chicago has a lot of green spaces millennium Park Grant Park.
,1713539477283,0,811ms,124,1713539477283,1713539489135,Lincoln Park. Estos espacios ofrecen áreas de recreación al aire libres senderos para caminar y hermosos paisajes urbanos. ,344ms,105,Lincoln Park. These spaces offer outdoor recreation areas walking trails and beautiful urban landscapes.
,1713539489843,0,1457ms,279,1713539489844,1713539512249,En resumen Chicago es una ciudad dinámica y diversa con mucho que ofrecer a sus residentes y visitantes desde su impresionante arquitectura hasta su rica escena cultura y gastronómica es un destino turístico popular que atrae a millones de personas de todo el mundo cada año.,724ms,273,In short Chicago is a dynamic and diverse city with much to offer its residents and visitors from its impressive architecture to its rich scene culture and cuisine. It is a popular tourist destination that attracts millions of people from all over the world every year.
,1713539554165,1,611ms,56,1713539554168,1713539558962,Have you ever gone on any boat tour or around your city?,184ms,58,¿Alguna vez has ido a algún tour en barco o por tu ciudad?
,1713539577643,0,4932ms,1878,1713539577644,1713539768486,Allí Chicago ofrece varias opciones a de paseos en barco que son populares entre los residentes y visitantes por igual ya tenemos arquitectura o un un Cruz de arquitectura este Cruz en barco son muy populares en Chicago. La crucero por el río Chicago ofrece una vista única de arquitectura y cónico. De la ciudad puedes conocer un poco de la historia y te dais a los las personas que te llevan te dan información sobre los edificios y la historia de Chicago. También tenemos en la los Tours de de barco son varias compañías ofrecen recorridos en barco a lo largo de Chicago. Estos Tours también pueden estar enfocados en las excursiones. Arquitectónicas hasta cruceros temáticos y Tours privados también los paseos en barco por el lago mexicano ofrecen impresionantes vistas del horizonte de Chicago al frente en el lago eh estos usualmente puedes agarrarlos por el en la playa de la avenida norte y también por el museo de ciencia e industria. También tenemos barcos turísticos en el Nef peer es un destino turístico emblemático de Chicago. Ofrece una variedad de opciones de paseos en barco cruceros panorámicos hasta excursiones. En velero hay opciones también A. Con gustos depende el gusto del presupuesto que tengas hay a kayaks y a pews. Hasta una experiencia más activa algunas compañías ofrecen cualquier amalquillabox para explorar el río Chicago así que tenemos bastante variedad. El verano es bastante corto y a tratamos de disfrutar bastante lo que se halago. En cuanto es verano e la los botes que puedes agarrar en A ¿Naves también ofrecen a? Cenas y puedes ser de 1 hora y media más o menos agarrarás el bote te subes disfrutad de la vista desde el barco hacia la ciudad y mientras navega por el lago puedes cenar bailar o escuchar música así que lo puedes también rentar mi hermano se casó en uno de ellos así que es. Es muy. Es muy lindo.,4492ms,1714,There Chicago offers several options to boat trips that are popular with residents and visitors alike whether we have architecture or a cross of architecture this cross by boat are very popular in Chicago. The Chicago River Cruise offers a unique view of architecture and conical. From the city you can learn a little about the history and you give the people who take you information about the buildings and the history of Chicago. We also have in the boat tours are several companies offer boat tours along Chicago. These Tours can also be focused on excursions. Architectural even themed cruises and private tours also the boat trips on the Mexican lake offer stunning views of the Chicago skyline in front of the lake eh these you can usually grab on the beach on the north avenue and also by the museum of science and industry. We also have tourist boats on the Nef peer it's an iconic tourist destination in Chicago. It offers a variety of options from boat trips cruises panoramic tours to excursions. In sailing there are also options A. With tastes it depends on the taste of the budget you have to kayaks and pews. Even a more active experience some companies offer any amalquillabox to explore the Chicago River so we have quite a lot of variety. Summer is quite short and we try to enjoy what is flattered. As soon as it's summer the boats you can grab in A. Do you also offer to? Dinners and you can be an hour and a half or so you'll grab the boat you'll get on you'll enjoy the view from the boat to the city and as you sail down the lake you can have dinner dancing or listen to music so you can also rent it my brother got married in one of them so it's very. It's very nice.
,1713539891845,1,513ms,65,1713539891848,1713539896521,I'm glad to know that your Brother got married. One of the boats.,1713539897034ms,58,Me alegra saber que tu hermano se casó. Uno de los barcos.
,1713539903046,1,584ms,83,1713539903047,1713539909451,You know a lot of things about Chicago. It was reopening in Nice talking to public.,1713539910035ms,84,Sabes muchas cosas sobre Chicago. Estaba reabriendo en Niza hablando con el público.
,1713539903765,0,607ms,48,1713539903767,1713539910652,Si fue bastante bonito eso pasó ahora se casi. ,191ms,55,If it was pretty pretty that happened now it's almost.
,1713539911721,0,468ms,9,1713539911722,1713539914101,Vivo aquí,84ms,12,I live here.
,1713539917681,1,618ms,48,1713539917683,1713539921283,How many years you have been staying in Chicago?,154ms,32,¿Cuántos años llevas en Chicago?
,1713539926007,0,1789ms,300,1713539926009,1713539961680,Wuaao tengo desde desde el 81 y viendo aquí 1981 así que son muchísimos años casi casi toda mi vida he vivido en Chicago crecí aquí he ido a la escuela aquí y disfrutó cada año diferentes partes de la ciudad y de los estados alrededor mío para poder aprender más. Acerca de la cultura la comida. Y,1458ms,287,I've had since I was '81 and watching here 1981 so it's been a lot of years almost all my life I've lived in Chicago I grew up here I've gone to school here and I enjoyed every year different parts of the city and the states around me to be able to learn more. About culture food. And
,1713539962041,0,763ms,97,1713539962042,1713539972608,Arquitectura me encanta los espacios naturales también así que sí tengo muchísimos años aquí. ,281ms,77,Architecture I love natural spaces too so yeah I have a lot of years here.
,1713539996043,1,530ms,31,1713539996046,1713540001201,Wow so many years in one city.,144ms,31,Wow tantos años en una ciudad.
,1713540006760,1,566ms,34,1713540006762,1713540010482,You must be really loving Chicago.,137ms,39,Debes ser realmente amoroso de Chicago.
,1713540007885,0,661ms,59,1713540007887,1713540015293,Sí bueno me encanta viajar también pero eh mi ciudad. ,227ms,51,Yeah well I love to travel too but uh my city.
,1713540016605,0,1752ms,290,1713540016607,1713540044163,Mi ciudad es Chicago aquí es mi casa y aquí he crecido con mis padres mis hermanos como dije he estudiado acá también pero he viajado a otros lugares para conocer diferentes culturas diferente arquitectura diferente ah amor forma de vida y también a la comida. Me encanta la comida.,1056ms,276,My city is Chicago here is my home and here I have grown up with my parents my siblings as I said I have studied here too but I have traveled to other places to know different cultures different different architecture ah love way of life and also to food. I love food.
,1713540068921,1,554ms,71,1713540068923,1713540074441,Glad I had this discussion with you. I got to know a lot about Chicago.,1713540074995ms,87,Me alegro de haber tenido esta discusión con usted. Llegué a saber mucho sobre Chicago.
,1713540075363,1,683ms,78,1713540075365,1713540083523,Unfortunately we have to close our discussion here as we are running of time.,238ms,95,Desafortunadamente tenemos que cerrar nuestro debate aquí ya que estamos corriendo el tiempo.
,1713540083248,0,686ms,47,1713540083252,1713540088685,Sí fue un placer y bueno los esperamos aquí. ,220ms,61,Yes it was a pleasure and well we are waiting for you here.
,1713540095163,1,583ms,110,1713540095164,1713540102450,Definitely if I ever get a chance to visit Chicago I'll carry. I could call you and try to play a list to you.,1713540103033ms,132,Definitivamente si alguna vez tengo la oportunidad de visitar Chicago voy a llevar. podría llamarte e intentar jugar una lista a ti.
,1713540097564,0,681ms,68,1713540097565,1713540102650,Muy bien no hay ningún problema. Muchísimas gracias por su tiempo. ,232ms,65,All right there's no problem. Thank you very much for your time.
,1713540113205,0,496ms,24,1713540113205,1713540116883,Definitivamente que sí. ,92ms,15,Definitely yes.
,1713540113522,1,439ms,16,1713540113523,1713540115643,Have a good day.,23ms,17,¡Ten un buen día.
,1713540119247,0,354ms,10,1713540119248,1713540121642,Igualmente,24ms,9,Same here
,1713540127685,1,409ms,9,1713540127686,1713540129722,Take care,30ms,7,Cuídate
,1713540133486,0,462ms,10,1713540133487,1713540135724,Tú también,75ms,8,You too.
